plen 4                  [hci0] 594.562503
        Status: Success (0x00)
        Handle: 68
        Encryption: Enabled with AES-CCM (0x01)
< ACL Data TX: Handle 68 flags 0x00 dlen 7                    [hci0] 594.562935
      ATT: Read Request (0x0a) len 2
        Handle: 0x000f
> HCI Event: Number of Completed Packets (0x13) plen 5        [hci0] 594.632593
        Num handles: 1
        Handle: 68
        Count: 1
> ACL Data RX: Handle 68 flags 0x02 dlen 21                   [hci0] 594.702407
      SMP: Encryption Information (0x06) len 16
        Long term key: 66568a05f98defaee1db73d1f005c162
> ACL Data RX: Handle 68 flags 0x02 dlen 15                   [hci0] 594.702988
      SMP: Master Identification (0x07) len 10
        EDIV: 0x0000
        Rand: 0x0000000000000000
> ACL Data RX: Handle 68 flags 0x02 dlen 6                    [hci0] 594.703578
      ATT: Read Response (0x0b) len 1
        Value: 32
< ACL Data TX: Handle 68 flags 0x00 dlen 7                   [hci0] 1040.170065
      ATT: Read Request (0x0a) len 2
        Handle: 0x000f
> HCI Event: Number of Completed Packets (0x13) plen 5       [hci0] 1040.201592
        Num handles: 1
        Handle: 68
        Count: 1
> ACL Data RX: Handle 68 flags 0x02 dlen 6                   [hci0] 1040.271265
      ATT: Read Response (0x0b) len 1
        Value: 32
Bluetooth monitor ver 5.37
= New Index: 00:1A:7D:DA:71:13 (BR/EDR,USB,hci0)                [hci0] 0.408175
= Open Index: 00:1A:7D:DA:71:13                                 [hci0] 0.408176
= Index Info: 00:1A:7D:DA:71:13 (Cambridge Silicon Radio)       [hci0] 0.408176
< HCI Command: LE Set Scan Enable (0x08|0x000c) plen 2          [hci0] 0.419121
        Scanning: Disabled (0x00)
        Filter duplicates: Enabled (0x01)
> HCI Event: Command Complete (0x0e) plen 4                     [hci0] 0.420430
      LE Set Scan Enable (0x08|0x000c) ncmd 1
        Status: Command Disallowed (0x0c)
< HCI Command: LE Set Scan Parameters (0x08|0x000b) plen 7      [hci0] 0.420459
        Type: Active (0x01)
        Interval: 10.000 msec (0x0010)
        Window: 10.000 msec (0x0010)
        Own address type: Public (0x00)
        Filter policy: Accept all advertisement (0x00)
> HCI Event: Command Complete (0x0e) plen 4                     [hci0] 0.421428
      LE Set Scan Parameters (0x08|0x000b) ncmd 1
        Status: Success (0x00)
< HCI Command: LE Set Scan Enable (0x08|0x000c) plen 2          [hci0] 0.436106
        Scanning: Enabled (0x01)
        Filter duplicates: Enabled (0x01)
> HCI Event: Command Complete (0x0e) plen 4                     [hci0] 0.437429
      LE Set Scan Enable (0x08|0x000c) ncmd 1
        Status: Success (0x00)
> HCI Event: LE Meta Event (0x3e) plen 19                       [hci0] 0.467456
      LE Advertising Report (0x02)
        Num reports: 1
        Event type: Connectable undirected - ADV_IND (0x00)
        Address type: Public (0x00)
        Address: B8:27:EB:EA:C5:B8 (Raspberry Pi Foundation)
        Data length: 7
        Flags: 0x06
          LE General Discoverable Mode
          BR/EDR Not Supported
        16-bit Service UUIDs (complete): 1 entry
          Unknown (0x12ab)
        RSSI: -49 dBm (0xcf)
> HCI Event: LE Meta Event (0x3e) plen 25                       [hci0] 0.469460
      LE Advertising Report (0x02)
        Num reports: 1
        Event type: Scan response - SCAN_RSP (0x04)
        Address type: Public (0x00)
        Address: B8:27:EB:EA:C5:B8 (Raspberry Pi Foundation)
        Data length: 13
        Name (short): commService
        RSSI: -49 dBm (0xcf)
< HCI Command: LE Create Connection (0x08|0x000d) plen 25       [hci0] 0.484857
        Scan interval: 60.000 msec (0x0060)
        Scan window: 30.000 msec (0x0030)
        Filter policy: White list is not used (0x00)
        Peer address type: Public (0x00)
        Peer address: B8:27:EB:EA:C5:B8 (Raspberry Pi Foundation)
        Own address type: Public (0x00)
        Min connection interval: 7.50 msec (0x0006)
        Max connection interval: 15.00 msec (0x000c)
        Connection latency: 0x0000
        Supervision timeout: 2000 msec (0x00c8)
        Min connection length: 2.500 msec (0x0004)
        Max connection length: 3.750 msec (0x0006)
> HCI Event: Command Status (0x0f) plen 4                       [hci0] 0.488459
      LE Create Connection (0x08|0x000d) ncmd 1
        Status: Success (0x00)
> HCI Event: LE Meta Event (0x3e) plen 19                       [hci0] 0.573457
      LE Connection Complete (0x01)
        Status: Success (0x00)
        Handle: 67
        Role: Master (0x00)
        Peer address type: Public (0x00)
        Peer address: B8:27:EB:EA:C5:B8 (Raspberry Pi Foundation)
        Connection interval: 15.00 msec (0x000c)
        Connection latency: 0.00 msec (0x0000)
        Supervision timeout: 2000 msec (0x00c8)
        Master clock accuracy: 0x00
< HCI Command: LE Read Remote Used Feat.. (0x08|0x0016) plen 2  [hci0] 0.573635
        Handle: 67
@ Device Connected: B8:27:EB:EA:C5:B8 (1) flags 0x0000
> HCI Event: Command Status (0x0f) plen 4                       [hci0] 0.579434
      LE Read Remote Used Features (0x08|0x0016) ncmd 0
        Status: Success (0x00)
> HCI Event: Command Status (0x0f) plen 4                       [hci0] 0.690464
      NOP (0x00|0x0000) ncmd 1
        Status: Success (0x00)
< HCI Command: LE Set Scan Enable (0x08|0x000c) plen 2          [hci0] 0.690516
        Scanning: Disabled (0x00)
        Filter duplicates: Disabled (0x00)
> HCI Event: Command Complete (0x0e) plen 4                     [hci0] 0.698458
      LE Set Scan Enable (0x08|0x000c) ncmd 1
        Status: Success (0x00)
> HCI Event: LE Meta Event (0x3e) plen 12                       [hci0] 0.721463
      LE Read Remote Used Features (0x04)
        Status: Success (0x00)
        Handle: 67
        Features: 0x01 0x00 0x00 0x00 0x00 0x00 0x00 0x00
          LE Encryption
< ACL Data TX: Handle 67 flags 0x00 dlen 7                      [hci0] 0.728070
      ATT: Exchange MTU Request (0x02) len 2
        Client RX MTU: 256
> HCI Event: Number of Completed Packets (0x13) plen 5          [hci0] 0.736445
        Num handles: 1
        Handle: 67
        Count: 1
> ACL Data RX: Handle 67 flags 0x02 dlen 16                     [hci0] 0.750831
      LE L2CAP: Connection Parameter Update Request (0x12) ident 1 len 8
        Min interval: 40
        Max interval: 56
        Slave latency: 0
        Timeout multiplier: 200
< HCI Command: LE Connection Update (0x08|0x0013) plen 14       [hci0] 0.750896
        Handle: 67
        Min connection interval: 50.00 msec (0x0028)
        Max connection interval: 70.00 msec (0x0038)
        Connection latency: 0x0000
        Supervision timeout: 2000 msec (0x00c8)
        Min connection length: 0.000 msec (0x0000)
        Max connection length: 0.000 msec (0x0000)
@ New Conn Param: B8:27:EB:EA:C5:B8 (1) hint 0 min 0x0028 max 0x0038 latency 0x0000 timeout 0x00c8
> ACL Data RX: Handle 67 flags 0x02 dlen 7                      [hci0] 0.751473
      ATT: Exchange MTU Response (0x03) len 2
        Server RX MTU: 256
< ACL Data TX: Handle 67 flags 0x00 dlen 11                     [hci0] 0.751953
      ATT: Read By Group Type Request (0x10) len 6
        Handle range: 0x0001-0xffff
        Attribute group type: Primary Service (0x2800)
> HCI Event: Command Status (0x0f) plen 4                       [hci0] 0.756459
      LE Connection Update (0x08|0x0013) ncmd 1
        Status: Success (0x00)
> HCI Event: Number of Completed Packets (0x13) plen 5          [hci0] 0.766518
        Num handles: 1
        Handle: 67
        Count: 1
< ACL Data TX: Handle 67 flags 0x00 dlen 10                     [hci0] 0.766598
      LE L2CAP: Connection Parameter Update Response (0x13) ident 1 len 2
        Result: Connection Parameters accepted (0x0000)
> ACL Data RX: Handle 67 flags 0x02 dlen 24                     [hci0] 0.781103
      ATT: Read By Group Type Response (0x11) len 19
        Attribute data length: 6
        Attribute group list: 3 entries
        Handle range: 0x0001-0x0005
        UUID: Generic Access Profile (0x1800)
        Handle range: 0x0006-0x0009
        UUID: Generic Attribute Profile (0x1801)
        Handle range: 0x000a-0x0016
        UUID: Unknown (0x12ab)
> HCI Event: Number of Completed Packets (0x13) plen 5          [hci0] 0.781444
        Num handles: 1
        Handle: 67
        Count: 1
< ACL Data TX: Handle 67 flags 0x00 dlen 11                     [hci0] 0.782011
      ATT: Read By Group Type Request (0x10) len 6
        Handle range: 0x0017-0xffff
        Attribute group type: Primary Service (0x2800)
> HCI Event: Number of Completed Packets (0x13) plen 5          [hci0] 0.796517
        Num handles: 1
        Handle: 67
        Count: 1
> ACL Data RX: Handle 67 flags 0x02 dlen 9                      [hci0] 0.810868
      ATT: Error Response (0x01) len 4
        Read By Group Type Request (0x10)
        Handle: 0x0017
        Error: Attribute Not Found (0x0a)
< ACL Data TX: Handle 67 flags 0x00 dlen 11                     [hci0] 0.814613
      ATT: Read By Type Request (0x08) len 6
        Handle range: 0x000a-0x0016
        Attribute type: Characteristic (0x2803)
> HCI Event: Number of Completed Packets (0x13) plen 5          [hci0] 0.826475
        Num handles: 1
        Handle: 67
        Count: 1
> ACL Data RX: Handle 67 flags 0x02 dlen 27                     [hci0] 0.840934
> ACL Data RX: Handle 67 flags 0x01 dlen 7                      [hci0] 0.841508
      ATT: Read By Type Response (0x09) len 29
        Attribute data length: 7
        Attribute data list: 4 entries
        Handle: 0x000b
        Value: 1e0c00cd34
        Handle: 0x000e
        Value: 1e0f00ab78
        Handle: 0x0011
        Value: 1e1200ab21
        Handle: 0x0014
        Value: 1e1500ef56
< ACL Data TX: Handle 67 flags 0x00 dlen 11                     [hci0] 0.842587
      ATT: Read By Type Request (0x08) len 6
        Handle range: 0x0016-0x0016
        Attribute type: Characteristic (0x2803)
> HCI Event: Number of Completed Packets (0x13) plen 5          [hci0] 0.856514
        Num handles: 1
        Handle: 67
        Count: 1
> ACL Data RX: Handle 67 flags 0x02 dlen 9                      [hci0] 0.871043
      ATT: Error Response (0x01) len 4
        Read By Type Request (0x08)
        Handle: 0x0016
        Error: Attribute Not Found (0x0a)
> HCI Event: LE Meta Event (0x3e) plen 10                       [hci0] 0.915476
      LE Connection Update Complete (0x03)
        Status: Success (0x00)
        Handle: 67
        Connection interval: 70.00 msec (0x0038)
        Connection latency: 0.00 msec (0x0000)
        Supervision timeout: 2000 msec (0x00c8)
< ACL Data TX: Handle 67 flags 0x00 dlen 7                     [hci0] 59.010715
      ATT: Read Request (0x0a) len 2
        Handle: 0x000f
> HCI Event: Number of Completed Packets (0x13) plen 5         [hci0] 59.023353
        Num handles: 1
        Handle: 67
        Count: 1
> ACL Data RX: Handle 67 flags 0x02 dlen 9                     [hci0] 59.085882
      ATT: Error Response (0x01) len 4
        Read Request (0x0a)
        Handle: 0x000f
        Error: Insufficient Authentication (0x05)
< ACL Data TX: Handle 67 flags 0x00 dlen 11                    [hci0] 59.086603
      SMP: Pairing Request (0x01) len 6
        IO capability: NoInputNoOutput (0x03)
        OOB data: Authentication data not present (0x00)
        Authentication requirement: Bonding, No MITM, Legacy, No Keypresses (0x01)
        Max encryption key size: 16
        Initiator key distribution: <none> (0x00)
        Responder key distribution: EncKey (0x01)
> HCI Event: Number of Completed Packets (0x13) plen 5         [hci0] 59.156354
        Num handles: 1
        Handle: 67
        Count: 1
> ACL Data RX: Handle 67 flags 0x02 dlen 11                    [hci0] 59.225884
      SMP: Pairing Response (0x02) len 6
        IO capability: NoInputNoOutput (0x03)
        OOB data: Authentication data not present (0x00)
        Authentication requirement: Bonding, No MITM, Legacy, No Keypresses (0x01)
        Max encryption key size: 16
        Initiator key distribution: <none> (0x00)
        Responder key distribution: EncKey (0x01)
< ACL Data TX: Handle 67 flags 0x00 dlen 21                    [hci0] 59.228161
      SMP: Pairing Confirm (0x03) len 16
        Confim value: 31d13167d60a36181fe644560e0ae68d
> HCI Event: Number of Completed Packets (0x13) plen 5         [hci0] 59.303356
        Num handles: 1
        Handle: 67
        Count: 1
> ACL Data RX: Handle 67 flags 0x02 dlen 21                    [hci0] 59.366029
      SMP: Pairing Confirm (0x03) len 16
        Confim value: a1155520dbeebe6a3dbe9213902b3d21
< ACL Data TX: Handle 67 flags 0x00 dlen 21                    [hci0] 59.366955
      SMP: Pairing Random (0x04) len 16
        Random value: c53672e046c6a1cf86e82e09d1dd4757
> HCI Event: Number of Completed Packets (0x13) plen 5         [hci0] 59.436367
        Num handles: 1
        Handle: 67
        Count: 1
> ACL Data RX: Handle 67 flags 0x02 dlen 21                    [hci0] 59.506023
      SMP: Pairing Random (0x04) len 16
        Random value: 18d8f79d5c3c51c838dc954bacbff3d0
< HCI Command: LE Start Encryption (0x08|0x0019) plen 28       [hci0] 59.510485
        Handle: 67
        Random number: 0x0000000000000000
        Encrypted diversifier: 0x0000
        Long term key: 5214a08037bfb9e54165a00b21b274cd
> HCI Event: Command Status (0x0f) plen 4                      [hci0] 59.519411
      LE Start Encryption (0x08|0x0019) ncmd 1
        Status: Success (0x00)
> HCI Event: Encryption Change (0x08) 